{
  "project_version": "0.1.0",
  "current_milestone": "M4",
  "services": [
    "ingress-service",
    "identity-service",
    "apikey-service",
    "execution-service",
    "routing-service",
    "prompt-service",
    "billing-service",
    "audit-service"
  ],
  "api_contract_versions": {
    "openapi": "v0",
    "downstream": "openai-compatible-v1"
  },
  "event_contract_versions": {
    "execution.invocation.completed": "v1",
    "audit.operation.recorded": "v1",
    "billing.usage.recorded": "v1"
  },
  "open_risks": [
    "No production auth/session strategy finalized",
    "No upstream retry/circuit-breaker policy finalized",
    "Ingress /v1/responses is currently implemented through chat-pipeline adaptation and does not yet provide full Responses API parity for all advanced fields"
  ],
  "next_actions": [
    "Implement execution-service producer for execution.invocation.completed with complete metadata (event_id, event_version, trace_id, idempotency_key)",
    "Implement billing-service Kafka consumer for execution.invocation.completed with idempotent usage persistence",
    "Implement audit-service Kafka consumer for execution.invocation.completed with queryable invocation index persistence"
  ],
  "last_verified_commit": "UNCOMMITTED",
  "updated_at": "2026-03-14T08:23:10Z"
}
